{"currency":"micro-CNY","effective_date_state":"pending_current_review","input_cached_tariff_state":"pending_current_review","input_uncached_tariff_state":"pending_current_review","integer_accounting_only":true,"output_tariff_state":"pending_current_review","owner_policy_acceptance":"PENDING_EXPLICIT_APPROVAL","phase_id":"phase11c-provider-canary-v1","policy_evidence_sha256":"PENDING_CURRENT_REVIEW","policy_reviewed_at":"PENDING_CURRENT_REVIEW","provider":"glm","provider_data_use_policy_url":"PENDING_CURRENT_REVIEW","provider_retention_policy_url":"PENDING_CURRENT_REVIEW","request_model_id":"glm-5.2","schema_version":"phase11c-provider-canary-tariff/v1","tariff_manifest_sha256":"fe56c25a178c599ab6a8cebc44727c3353d728c1af5c92fb18abb1b11e28239f","tariff_review_state":"pending_current_review"}
